{"run":1,"commit":"deef32fbf94468dc6c5e15bfb8abb0db8e9d583a","metric":0.0,"metrics":{"distill_delta_holdout":0.0,"distill_specificity_delta":0.06521739130434782,"persistent_bytes":17699231,"wall_s":392.053084286988,"teacher_dev_delta":0.6,"lora_rank":8,"lora_alpha":16.0,"max_steps":10,"lora_lr":0.005,"seeds":2,"stage":"stage_3_dialog"},"status":"discard","description":"mlp LoRA rank=8 alpha=16 max_steps=10 lora_lr=0.005 seeds=2 on stage_3_dialog. distill_delta_holdout=0.0 (not > 0.0), teacher_dev_delta=0.6 (gate passes), specificity_delta=0.0652. Persistent LoRA bytes=17699231, total wall_s=392.05. DISCARD: primary metric not > 0.0."}
{"type":"config","name":"research-18-mlp-stage3-dialog-max20","metricName":"distill_delta_holdout","metricUnit":"delta","bestDirection":"higher","goal":"mlp LoRA rank=8 alpha=16 max_steps=20 lora_lr=0.005 on stage_3_dialog, seeds=2"}
{"run": 1, "commit": "deef32fbf94468dc6c5e15bfb8abb0db8e9d583a", "metric": 0.0, "metrics": {"distill_delta_holdout": 0.0, "distill_specificity_delta": 0.0, "persistent_bytes": 17699903, "wall_s": 456.90972613199847, "teacher_dev_delta": 0.6, "lora_rank": 8, "lora_alpha": 16.0, "max_steps": 20, "lora_lr": 0.005, "seeds": 2, "stage": "stage_3_dialog"}, "status": "discard", "description": "mlp LoRA rank=8 alpha=16 max_steps=20 lora_lr=0.005 seeds=2 on stage_3_dialog. distill_delta_holdout=0.0 (not > 0.0), teacher_dev_delta=0.6 (gate passes), specificity_delta=0.0. Persistent LoRA bytes=17699903, total wall_s=456.91. DISCARD: primary metric not > 0.0."}
{"type":"config","name":"research-18-mlp-stage5-cross-domain","metricName":"distill_delta_holdout","metricUnit":"delta","bestDirection":"higher","goal":"mlp LoRA rank=8 alpha=16 max_steps=10 lora_lr=0.005 on stage_5_cross_domain, seeds=2"}
{"run":1,"commit":"b1e3a7faf800a4ea869b13e685f4073a355676df","metric":0.0,"metrics":{"distill_delta_holdout":0.0,"distill_specificity_delta":0.08695652173913043,"persistent_bytes":17699275,"wall_s":520.7354067870183,"teacher_dev_delta":0.0,"lora_rank":8,"lora_alpha":16.0,"max_steps":10,"lora_lr":0.005,"seeds":2,"stage":"stage_5_cross_domain"},"status":"discard","description":"mlp LoRA rank=8 alpha=16 max_steps=10 lora_lr=0.005 seeds=2 on stage_5_cross_domain. distill_delta_holdout=0.0 (not > 0.0), teacher_dev_delta=0.0 (gate fails), specificity_delta=0.0870. Persistent LoRA bytes=17699275, total wall_s=520.74. DISCARD: primary metric not > 0.0."}
{"type":"config","name":"research-18-mlp-stage1-transfer-max20","metricName":"distill_delta_holdout","metricUnit":"delta","bestDirection":"higher","goal":"mlp LoRA rank=8 alpha=16 max_steps=20 lora_lr=0.005 on stage_1_transfer, seeds=2"}
